{
  "model_id": "sentence-transformers/all-MiniLM-L6-v2",
  "revision": "1110a243fdf4706b3f48f1d95db1a4f5529b4d41",
  "license": "Apache-2.0",
  "dimension": 384,
  "pooling": "mean",
  "normalize": true,
  "max_tokens": 256,
  "query_prefix": "",
  "passage_prefix": "",
  "onnx": {
    "inputs": [
      "input_ids",
      "attention_mask",
      "token_type_ids"
    ],
    "output": "last_hidden_state"
  },
  "runtime": {
    "onnxruntime": "1.30.0",
    "onnxruntime_node": "1.30.0",
    "tokenizers": "0.23.2",
    "huggingface_tokenizers": "0.2.0"
  },
  "files": [
    {
      "path": "onnx/model.onnx",
      "sha256": "6fd5d72fe4589f189f8ebc006442dbb529bb7ce38f8082112682524616046452",
      "bytes": 90405214,
      "url": "https://huggingface.co/sentence-transformers/all-MiniLM-L6-v2/resolve/1110a243fdf4706b3f48f1d95db1a4f5529b4d41/onnx/model.onnx"
    },
    {
      "path": "tokenizer.json",
      "sha256": "be50c3628f2bf5bb5e3a7f17b1f74611b2561a3a27eeab05e5aa30f411572037",
      "bytes": 466247,
      "url": "https://huggingface.co/sentence-transformers/all-MiniLM-L6-v2/resolve/1110a243fdf4706b3f48f1d95db1a4f5529b4d41/tokenizer.json"
    }
  ],
  "fixture": "fixtures/embeddings/all-minilm-l6-v2.json"
}
